title,genres,keywords,overview
The Matrix,Action Sci-Fi,virtual reality hacker rebellion,"A computer hacker learns about the true nature of reality and his role in the war against its controllers."
Inception,Action Thriller,dream subconscious heist,"A thief who steals corporate secrets through dream-sharing technology is given a chance to erase his past."
Interstellar,Adventure Drama,space time relativity,"A group of explorers travel through a wormhole in space in an attempt to ensure humanity's survival."
The Prestige,Drama Mystery,illusion magician rivalry,"After a tragic accident, two stage magicians engage in a battle to create the ultimate illusion."
The Dark Knight,Action Crime,hero villain chaos,"Batman faces the Joker, a criminal mastermind who plunges Gotham into anarchy."
